name,categories,images,rating,price,description,created_at,updated_at
"POWRSOX 4 Pairs Sports Socks for Men Moisture-Wicking, Compression, and Cushioning for Superior Performance and Comfort, P...","[""All Exercise & Fitness""]",https://m.media-amazon.com/images/W/IMAGERENDERING_521856-T1/images/I/91fbkPfZjsL._AC_UL320_.jpg,5.0,222223,"A pack of four pairs of moisture-wicking sports socks designed for men, offering compression support and cushioning for improved performance and comfort during workouts or sports activities.",2025-02-12 16:04:48.188327,2025-02-12 16:04:48.188327
"Fitcozi Exercise & Fitness Advance Wobble Balance Board For Balance & Stability Training for Whole Family - Kids, Teens & ...","[""All Exercise & Fitness""]",https://m.media-amazon.com/images/I/71CtUWz8XoL._AC_UL320_.jpg,3.8,370495,"An advanced wobble balance board designed to improve balance, stability, and core strength. Suitable for all ages, from kids to adults, and ideal for home or gym workouts.",2025-02-12 16:04:48.188327,2025-02-12 16:04:48.188327
Longies Women's Cotton Non Padded Wire Free Sports Bra,"[""All Exercise & Fitness""]",https://m.media-amazon.com/images/I/715ghJ5-AiS._AC_UL320_.jpg,3.9,222223,"A comfortable, non-padded, wire-free sports bra made from soft cotton. Designed for women, offering light support and comfort during low-impact activities or everyday wear.",2025-02-12 16:04:48.188327,2025-02-12 16:04:48.188327
"ZIVIK Sit-ups Assistant Device, Upgraded Sit-up Fitness Equipment Muscle Exercise Abdominal Device Portable Sit Up Bar wit...","[""All Exercise & Fitness""]",https://m.media-amazon.com/images/I/51kc0YeAA6S._AC_UL320_.jpg,4.4,296359,"An upgraded sit-up assistant device designed to support abdominal workouts. Portable and easy to use, it helps improve sit-up form and enhances muscle activation for more effective core training.",2025-02-12 16:04:48.188327,2025-02-12 16:04:48.188327
Jockey Women's Tailored Fit Thermal Top,"[""All Exercise & Fitness""]",https://m.media-amazon.com/images/I/81zj09l9HAL._AC_UL320_.jpg,4.2,96191,"A thermal top for women, designed for warmth and comfort during colder weather or outdoor activities. The tailored fit provides a flattering look while offering full flexibility.",2025-02-12 16:04:48.188327,2025-02-12 16:04:48.188327
"CONSONANTIAM Resistance Loop Exercise Bands for Home Fitness & Yoga || Men & Women Exercise Fitness Band (Multicolor, Set ...","[""All Exercise & Fitness""]",https://m.media-amazon.com/images/I/51+1VvB-y9L._AC_UL320_.jpg,3.3,185155,"A set of multicolor resistance loop exercise bands designed for home fitness and yoga. Perfect for strengthening, toning, and improving flexibility, suitable for both men and women.",2025-02-12 16:04:48.188327,2025-02-12 16:04:48.188327
Bodyband Gym Ball for Exercise Anti Burst Exercise Ball with Foot Pump for Workout Yoga Ball for Women and Men Swiss Ball ...,"[""All Exercise & Fitness""]",https://m.media-amazon.com/images/I/51YKkY8tS7L._AC_UL320_.jpg,4.8,259291,"A durable anti-burst gym ball for exercises such as yoga, pilates, and core workouts. Comes with a foot pump for easy inflation, providing a stable surface for both men and women.",2025-02-12 16:04:48.188327,2025-02-12 16:04:48.188327
RACHEYTA Ultra-Thin Transparent Nylon Summer Ankle Length Stocking Socks for Women/Girl's,"[""All Exercise & Fitness""]",https://m.media-amazon.com/images/I/51YbjWHW3fL._AC_UL320_.jpg,3.6,73951,"Ultra-thin transparent nylon ankle-length stockings for women and girls, perfect for summer wear. Offers comfort and style with a lightweight and breathable design.",2025-02-12 16:04:48.188327,2025-02-12 16:04:48.188327
"Bodylastics Yoga Wheel for Women and Men Fitness 13” Strong, Sweat Resistant & Eco-Friendly","[""All Exercise & Fitness""]",https://m.media-amazon.com/images/I/712WUjc0A+L._AC_UL320_.jpg,4.3,555835,"A 13-inch yoga wheel designed for both women and men, offering support for deep stretches and enhancing yoga poses. Made from eco-friendly and sweat-resistant materials for durability.",2025-02-12 16:04:48.188327,2025-02-12 16:04:48.188327
Aegon Sit Up Assistant Device Bar | Abs Master | Crunches Equipment | Gym Instrument for Home Workout | Abdominal Push Up...,"[""All Exercise & Fitness""]",https://m.media-amazon.com/images/I/41p97GmwKNL._AC_UL320_.jpg,4.1,277825,"A sit-up assistant bar designed to aid in abdominal exercises and crunches. Ideal for enhancing sit-up form, this gym instrument provides support and improves muscle engagement for more effective results.",2025-02-12 16:04:48.188327,2025-02-12 16:04:48.188327
Jockey AW87 Women's Super Combed Cotton Elastane Stretch Slim Fit Leggings with Ultrasoft Waistband,"[""All Exercise & Fitness""]",https://m.media-amazon.com/images/I/31ROcDGsyWL._AC_UL320_.jpg,4.3,105458,"Slim-fit leggings for women made from super combed cotton elastane, offering comfort and flexibility for workouts or casual wear. The ultrasoft waistband provides a smooth, secure fit.",2025-02-12 16:04:48.188327,2025-02-12 16:04:48.188327
Shopoflux® Treadmill Safety Key | Universal Treadmill Magnet Security Lock | Fitness Replacement Kit for All Treadmill- Red,"[""All Exercise & Fitness""]",https://m.media-amazon.com/images/I/814JhP78rdL._AC_UL320_.jpg,4.3,129738,"A universal treadmill safety key and magnet security lock, designed to ensure safe operation of any treadmill. Ideal for replacing old or lost keys for fitness machines.",2025-02-12 16:04:48.188327,2025-02-12 16:04:48.188327
"Boldfit Ab Roller For Men & Women. Abs Exercise Equipment For Tummy. Usable In Gym Workout, Home Workout, Abdominal Exerci...","[""All Exercise & Fitness""]",https://m.media-amazon.com/images/I/91OkZoVbxJL._AC_UL320_.jpg,4.3,148087,"An ab roller designed for both men and women, providing an effective workout tool for toning and strengthening the abdominal muscles. Ideal for gym or home use, offering a complete core workout.",2025-02-12 16:04:48.188327,2025-02-12 16:04:48.188327
APRODO Sports DIP Belt with Steel Chain 36 INCHES Weighted Chain for DIPS Pull UPS Weight Lifting Crossfit ONE Size FITS All,"[""All Exercise & Fitness""]",https://m.media-amazon.com/images/I/51qDNJSAQ9L._AC_UL320_.jpg,4.5,139005,"A 36-inch dip belt with a steel chain, perfect for adding extra weight during dips, pull-ups, or weightlifting exercises. One size fits all, ideal for crossfit and strength training.",2025-02-12 16:04:48.188327,2025-02-12 16:04:48.188327
Peppyzone Men's Camouflage Regular Fit Track Pant,"[""All Exercise & Fitness""]",https://m.media-amazon.com/images/I/610BjJqZ67L._AC_UL320_.jpg,3.6,240757,"A pair of camouflage regular-fit track pants for men, offering comfort and style for outdoor workouts, running, or casual wear.",2025-02-12 16:04:48.188327,2025-02-12 16:04:48.188327
"DAZIBAO® Double Toning Resistance Tube Pull Rope Elastic Rubber Exercise Band for Stretching, Workout, Home Gym and Toning...","[""All Exercise & Fitness""]",https://m.media-amazon.com/images/I/614aNZj4QUL._AC_UL320_.jpg,3.8,203689,"A double-toning resistance tube for stretching, toning, and full-body workouts. Made of elastic rubber, it’s perfect for use at home or in the gym to enhance flexibility and strength.",2025-02-12 16:04:48.188327,2025-02-12 16:04:48.188327
"Sector z Unisex Faux Leather Triangle Gym Bag (Tan, 25 L)","[""All Exercise & Fitness""]",https://m.media-amazon.com/images/I/71ZkacavrAL._AC_UL320_.jpg,3.4,92485,"A 25L faux leather gym bag with a triangle design, offering both style and functionality. Perfect for storing gym gear or personal items, suitable for both men and women.",2025-02-12 16:04:48.188327,2025-02-12 16:04:48.188327
"Spotzero By Milton Tejas Yoga Mat, Pink (CCPDGEN048ASSR0020)","[""All Exercise & Fitness""]",https://m.media-amazon.com/images/I/819VYrYGSfL._AC_UL320_.jpg,4.8,333427,"A durable pink yoga mat designed by Spotzero, ideal for yoga, Pilates, and general floor exercises. Provides comfort and stability with a non-slip surface.",2025-02-12 16:04:48.188327,2025-02-12 16:04:48.188327
"VIFITKIT Foam Roller for Deep Tissue Muscle Massage, Trigger Point Therapy, Exercise, and Workout (Blue, 12*4 inches)","[""All Exercise & Fitness""]",https://m.media-amazon.com/images/I/51AgM1b6vtL._AC_UL320_.jpg,4.0,296359,"A foam roller designed for deep tissue muscle massage, trigger point therapy, and exercise. Ideal for muscle recovery, stretching, and improving flexibility, available in a 12x4 inch size.",2025-02-12 16:04:48.188327,2025-02-12 16:04:48.188327
"EasyHealth Professional Grade 22"" Wrist Band for Men Gym, Wrist Supporter for Gym Wrist wrap/Straps, Gym Accessories for M...","[""All Exercise & Fitness""]",https://m.media-amazon.com/images/I/71YhNkBP+7L._AC_UL320_.jpg,4.3,92485,Detailed description not available.,2025-02-12 16:04:48.188327,2025-02-12 16:04:48.188327
"Protoner Spare Weight Lifting Plates for Home Gym, 2.5 kg x 4","[""All Exercise & Fitness""]",https://m.media-amazon.com/images/I/61Y0yRHfmRL._AC_UL320_.jpg,3.4,333427,"A set of four 2.5 kg spare weightlifting plates, perfect for customizing weight sets at home. Ideal for use with barbells, dumbbells, or other gym equipment.",2025-02-12 16:04:48.188327,2025-02-12 16:04:48.188327
Dr Trust TPE Premium Luxfoam Yoga Mat for Gym Workout and Flooring Exercise Yoga Mat for Men and Women Fitness - 317,"[""All Exercise & Fitness""]",https://m.media-amazon.com/images/I/81wvPXmY45L._AC_UL320_.jpg,4.4,741360,"A high-quality TPE yoga mat with Luxfoam technology, providing superior comfort and stability for yoga, gym workouts, or floor exercises. Ideal for both men and women.",2025-02-12 16:04:48.188327,2025-02-12 16:04:48.188327
GOCART WITH G LOGO 65-70 KG Strengthener Strength Trainer Adjustable 150lbs Metal Hand Grip/Fitness Grip-1pcs,"[""All Exercise & Fitness""]",https://m.media-amazon.com/images/I/41oTg0XNbFL._AC_UL320_.jpg,4.5,203689,"An adjustable hand grip strengthener with a resistance capacity of up to 150 lbs, perfect for improving grip strength and forearm muscles during strength training.",2025-02-12 16:04:48.188327,2025-02-12 16:04:48.188327
"GOCART WITH G LOGO Skipping Rope for Men Gym, Women, Weight Loss, Kids, Girls, Children, Adult Best in Sports, Fitness, Ex...","[""All Exercise & Fitness""]",https://m.media-amazon.com/images/I/71TrjSKEHhS._AC_UL320_.jpg,4.0,148087,"A high-quality skipping rope designed for all ages, from kids to adults. Perfect for weight loss, cardio workouts, and improving endurance, with adjustable length and durable materials.",2025-02-12 16:04:48.188327,2025-02-12 16:04:48.188327
Kobo WTA-04 Power Cotton Gym Support with Thumb Support Grip Gloves (Black),"[""All Exercise & Fitness""]",https://m.media-amazon.com/images/I/8168YBqLFsL._AC_UL320_.jpg,4.4,70429,"Cotton gym gloves designed with thumb support, offering a secure grip and added protection during weightlifting and other strength training exercises.",2025-02-12 16:04:48.188327,2025-02-12 16:04:48.188327
"PowerMax Fitness Multi-Purpose PMS-50 (50ml Silicone Oil Bottle) 100% Pure Silicone Treadmill Lubricant, Full Belt Width L...","[""All Exercise & Fitness""]",https://m.media-amazon.com/images/I/61m2UmNPs5L._AC_UL320_.jpg,4.3,53749,"A 50ml bottle of pure silicone treadmill lubricant, designed for maintaining treadmill performance. Provides smooth operation and reduces wear on the belt.",2025-02-12 16:04:48.188327,2025-02-12 16:04:48.188327
"SFANE Polyester 9.84 inches Grey Duffel Gym Bag, Shoulder Sports Bag for Men & Women with Shoe Compartment (Grey & Orange))","[""All Exercise & Fitness""]",https://m.media-amazon.com/images/I/91rKN59U1kL._AC_UL320_.jpg,4.4,258549,"A polyester 9.84-inch gym duffel bag with a shoe compartment, designed for both men and women. The grey and orange design offers both style and functionality for gym use or travel.",2025-02-12 16:04:48.188327,2025-02-12 16:04:48.188327
"Serveuttam Mini Pilates Ball - Small Exercise Ball for Yoga, Pilates, Barre, Physical Therapy, Stretching and Core Fitness...","[""All Exercise & Fitness""]",https://m.media-amazon.com/images/I/615NzMxM7PL._AC_UL320_.jpg,3.8,120471,"A mini Pilates ball designed for yoga, Pilates, barre, and physical therapy. Ideal for core fitness, stability training, and stretching exercises.",2025-02-12 16:04:48.188327,2025-02-12 16:04:48.188327
"MorningVale Burney Double Toning Resistance Tube Heavy Quality Rubber Exercise Band for Stretching, Full Body Workout, Hom...","[""All Exercise & Fitness""]",https://m.media-amazon.com/images/I/5141EFrFECL._AC_UL320_.jpg,3.6,92485,"A double toning resistance tube made from high-quality rubber, designed for stretching, full-body workouts, and strength training at home or the gym.",2025-02-12 16:04:48.188327,2025-02-12 16:04:48.188327
"Nivia Leather Weightlifting Gym Gloves for Men, Training Gloves, Workout Gloves, Hand Glove Gym Workout, Leather Gloves Me...","[""All Exercise & Fitness""]",https://m.media-amazon.com/images/I/61QjL1jS9VL._AC_UL320_.jpg,3.9,95450,"Leather weightlifting gloves designed for men, providing grip and hand protection during training and workouts. Ideal for strength training, crossfit, and bodybuilding.",2025-02-12 16:04:48.188327,2025-02-12 16:04:48.188327
"Mini Yoga Pilates Ball, AB SALES Exercise Ball, 9 Inch Bender with Inflatable Straw for Barre, Physical Therapy, Stabilit...","[""All Exercise & Fitness""]",https://m.media-amazon.com/images/I/61UEPi38b+L._AC_UL320_.jpg,4.0,46520,"A 9-inch mini exercise ball designed for barre, Pilates, and physical therapy. Features an inflatable straw for easy inflation and stability during workouts.",2025-02-12 16:04:48.188327,2025-02-12 16:04:48.188327
