name,categories,images,rating,price,description,created_at,updated_at
DIGITAL SHOPEE Skin Ultra Thin Socks for Women & Girls - Multicolor,"[""All Exercise & Fitness""]",https://m.media-amazon.com/images/I/514m+JUaR8L._AC_UL320_.jpg,3.7,240757,"A pack of ultra-thin, breathable socks designed for women and girls. Available in multiple colors, these socks are perfect for daily wear, yoga, or casual outings.",2025-02-12 16:04:48.188327,2025-02-12 16:04:48.188327
"OLAHRAGA Adjustable Hand Grip Strengthener Resistance from5-60 kg, Non-Slip Hand Gripper Perfect for Musicians Athletes an...","[""All Exercise & Fitness""]",https://m.media-amazon.com/images/I/51DO2xw67zL._AC_UL320_.jpg,4.3,185155,"An adjustable hand grip strengthener with resistance ranging from 5-60 kg. Non-slip design makes it suitable for improving grip strength in athletes, musicians, and general fitness enthusiasts.",2025-02-12 16:04:48.188327,2025-02-12 16:04:48.188327
Jockey Women Boy Leg,"[""All Exercise & Fitness""]",https://m.media-amazon.com/images/I/7152PCh-V8L._AC_UL320_.jpg,4.2,45408,"A comfortable and supportive boy leg design for women, providing full coverage and a secure fit. Ideal for everyday wear or light sports activities.",2025-02-12 16:04:48.188327,2025-02-12 16:04:48.188327
Zexer Men Men Compression T-Shirt Gym and Sports Wear T-Shirt for Men | Body fit Skinny T-Shirt (Black,"[""All Exercise & Fitness""]",https://m.media-amazon.com/images/I/51gLonI8VsL._AC_UL320_.jpg,4.1,62830,"A body-fit compression t-shirt designed for men, ideal for gym and sports activities. The skinny design enhances muscle definition while providing comfort and support.",2025-02-12 16:04:48.188327,2025-02-12 16:04:48.188327
JUGULAR Men's Slim Fit Track pants,"[""All Exercise & Fitness""]",https://m.media-amazon.com/images/I/71r3RWbLWAL._AC_UL320_.jpg,3.7,185155,"Slim fit track pants designed for men, providing comfort and flexibility for workouts or casual wear. Ideal for running, gym sessions, or everyday activities.",2025-02-12 16:04:48.188327,2025-02-12 16:04:48.188327
Kore (PVC/ Rubber/ Coloured Rubber/ Steel/ Professional Metal Integrted)  10 - 30 Kg Spare Weight Plates Combo,"[""All Exercise & Fitness""]",https://m.media-amazon.com/images/I/61eI78WDoQL._AC_UL320_.jpg,3.7,46150,Detailed description not available.,2025-02-12 16:04:48.188327,2025-02-12 16:04:48.188327
"Rioff® Steel Pull Up Chin up Bar, Steel Chin Up, Sangal Rod with Chain Hanging Rod ChinUp Bar, Height Increaser and Pull E...","[""All Exercise & Fitness""]",https://m.media-amazon.com/images/I/51OZ1x5Zt6L._AC_UL320_.jpg,4.2,231490,"A steel chin-up bar designed for enhancing upper body strength. Features a chain hanging rod for easy installation, and functions as a height increaser for pull-ups and chin-ups.",2025-02-12 16:04:48.188327,2025-02-12 16:04:48.188327
Aurion PVC Dumbbells - (1kg*2) (2kg*2) (3kg*2) (Set of 3) | Premium Hand Weight Dumbbell | Exercise and Fitness Training E...,"[""All Exercise & Fitness""]",https://m.media-amazon.com/images/I/71t8ANKkBzL._AC_UL320_.jpg,4.0,185155,"A set of premium PVC dumbbells, available in 1kg, 2kg, and 3kg pairs. Perfect for home gym use and strength training, designed for durability and ease of use.",2025-02-12 16:04:48.188327,2025-02-12 16:04:48.188327
"FitBox Sports Intruder Hand Grips, Set of 2 (Black)","[""All Exercise & Fitness""]",https://m.media-amazon.com/images/I/618dJgxlsrL._AC_UL320_.jpg,3.3,88036,A set of two hand grips designed to strengthen hand and forearm muscles. Ideal for improving grip strength and endurance during workouts or training.,2025-02-12 16:04:48.188327,2025-02-12 16:04:48.188327
"BROGBUS Weight Lifting Workout Gym Gloves with Wrist Support for Men and Women (XL, Black) Material: neoprene","[""All Exercise & Fitness""]",https://m.media-amazon.com/images/I/514qXNC3aeL._AC_UL320_.jpg,4.3,111019,"Neoprene gym gloves designed for weight lifting, featuring wrist support for added stability and protection. The XL size fits most hands, suitable for men and women.",2025-02-12 16:04:48.188327,2025-02-12 16:04:48.188327
Adidas Unisex Low Cut Cotton Blend Socks (Pack Of 3) (AD-0632 Lt Grey Mel/Black/Anthra Mel_Multicolor),"[""All Exercise & Fitness""]",https://m.media-amazon.com/images/I/81GffNsMvxL._AC_UL320_.jpg,4.0,101752,"A pack of three pairs of low-cut cotton blend socks from Adidas, offering comfort and breathability during sports or everyday use. Available in various colors to suit different preferences.",2025-02-12 16:04:48.188327,2025-02-12 16:04:48.188327
PLUMBURY Women's Nylon Lightly Padded Wire Free Sports Bra,"[""All Exercise & Fitness""]",https://m.media-amazon.com/images/I/61uC3C7agpS._AC_UL320_.jpg,3.6,166621,"A lightly padded, wire-free sports bra made from nylon, offering comfortable support for low-impact activities. Ideal for everyday wear and sports performance.",2025-02-12 16:04:48.188327,2025-02-12 16:04:48.188327
"FitBox Sports Adjustable Black/Gray Hand Grip (10kg - 40kg) Finger Excerciser, Hand Gripper For Men & Women","[""All Exercise & Fitness""]",https://m.media-amazon.com/images/I/61qILzqY7qL._AC_UL320_.jpg,3.9,90631,"An adjustable hand grip exerciser designed to strengthen fingers, wrists, and forearms. With resistance from 10kg to 40kg, it is perfect for both men and women.",2025-02-12 16:04:48.188327,2025-02-12 16:04:48.188327
Jockey Women's Cotton Top,"[""All Exercise & Fitness""]",https://m.media-amazon.com/images/I/71CYNFNXZrL._AC_UL320_.jpg,4.1,62830,"A comfortable cotton top designed for women, perfect for casual wear or light workouts. Soft, breathable fabric provides all-day comfort.",2025-02-12 16:04:48.188327,2025-02-12 16:04:48.188327
"OJS Yoga Mat for Women and Men with Strap And Cover Bag TPE Material Extra Thick Exercise Yoga Mat for Men for Workout, Yo...","[""All Exercise & Fitness""]",https://m.media-amazon.com/images/I/61i+MEUIOPL._AC_UL320_.jpg,5.0,277825,"An extra-thick TPE yoga mat with a carrying strap and cover bag, designed for both men and women. Ideal for yoga, workouts, and providing a stable and comfortable surface.",2025-02-12 16:04:48.188327,2025-02-12 16:04:48.188327
"Harissons Jake Gym Bag, 31 L Duffel Bag with Shoe Compartment - Navy Red, Unisex, Polyester | 3 in 1 Multi-Purpose Duffle ...","[""All Exercise & Fitness""]",https://m.media-amazon.com/images/I/81n3kmyrMGL._AC_UL320_.jpg,4.2,305626,"A versatile 31L gym duffel bag with a separate shoe compartment, made from durable polyester. Ideal for both men and women, this unisex bag is perfect for gym, travel, and everyday use.",2025-02-12 16:04:48.188327,2025-02-12 16:04:48.188327
"GOCART WITH G LOGO Resistance Bands, Exercise Bands Include 5 Different Levels Exercise Bands, Door Anchor, Foam Handles, ...","[""All Exercise & Fitness""]",https://m.media-amazon.com/images/I/71CjS28Z1zL._AC_UL320_.jpg,4.0,370495,"A set of resistance bands with five different resistance levels, complete with foam handles and a door anchor. Perfect for home or gym workouts, toning, and flexibility exercises.",2025-02-12 16:04:48.188327,2025-02-12 16:04:48.188327
EIO Unisex Kids Cotton Pajama Pants Pack of 6,"[""All Exercise & Fitness""]",https://m.media-amazon.com/images/I/51i9ProxZyL._AC_UL320_.jpg,3.8,277825,"A pack of six pairs of soft cotton pajama pants for kids. Comfortable and breathable, these are perfect for bedtime or lounging around the house.",2025-02-12 16:04:48.188327,2025-02-12 16:04:48.188327
"Boldfit Skipping Rope for Men and Women Jumping Rope With Adjustable Height Speed Skipping Rope for Exercise, Gym, Sports ...","[""All Exercise & Fitness""]",https://m.media-amazon.com/images/I/61GHfimWwuL._AC_UL320_.jpg,4.1,55417,"A high-quality skipping rope with adjustable height, designed for both men and women. Ideal for cardiovascular fitness, speed training, and toning muscles.",2025-02-12 16:04:48.188327,2025-02-12 16:04:48.188327
"STRAUSS Yoga Belt (Blue, 8 Feet)","[""All Exercise & Fitness""]",https://m.media-amazon.com/images/I/81H-LScfRIL._AC_UL320_.jpg,4.2,78770,"An 8-foot yoga belt in blue, designed for deepening stretches and improving flexibility. Durable and adjustable, ideal for yoga practice and physical therapy.",2025-02-12 16:04:48.188327,2025-02-12 16:04:48.188327
Signamio® Yoga Belt 8 Loop for Women and Men Extra Thick Exercise for Workout Yoga Fitness - Blue-Black-1pcs,"[""All Exercise & Fitness""]",https://m.media-amazon.com/images/I/71nvBRv6CoL._AC_UL320_.jpg,4.3,129553,"An extra-thick 8-loop yoga belt for both men and women, designed to assist in stretching, flexibility, and yoga poses. The durable material ensures a secure hold.",2025-02-12 16:04:48.188327,2025-02-12 16:04:48.188327
Chromozome Men's Regular Shorts,"[""All Exercise & Fitness""]",https://m.media-amazon.com/images/I/61aA1ucTyJL._AC_UL320_.jpg,3.9,122139,"Comfortable men's regular shorts designed for casual wear or light workouts. Made from breathable fabric, perfect for warm weather or active use.",2025-02-12 16:04:48.188327,2025-02-12 16:04:48.188327
"Amazon Brand - Symactive Rubber Coated Hex Dumbbells, Set of 2, 5 Kg","[""All Exercise & Fitness""]",https://m.media-amazon.com/images/I/81nZnXUMtjL._AC_UL320_.jpg,4.5,574554,"A set of two 5 kg rubber-coated hexagonal dumbbells, designed for home gym use. The rubber coating prevents damage to floors while providing a secure grip for strength training.",2025-02-12 16:04:48.188327,2025-02-12 16:04:48.188327
Birthday Popper Drawstring Sack Bag (Set of 15) Birthday Return Gifts for All Age Group,"[""All Exercise & Fitness""]",https://m.media-amazon.com/images/I/71UYw8OS79L._AC_UL320_.jpg,4.0,166806,"A set of 15 drawstring sack bags, perfect for birthday parties or return gifts. Ideal for packaging small gifts or treats for guests of all ages.",2025-02-12 16:04:48.188327,2025-02-12 16:04:48.188327
"Fitness Mantra® EVA Yoga Mat for Gym Workout and Yoga Exercise with 6mm Thickness, Anti-Slip Yoga Mat for Men & Women Fitn...","[""All Exercise & Fitness""]",https://m.media-amazon.com/images/I/61-w1cccjwL._AC_UL320_.jpg,4.0,277825,"A 6mm thick EVA yoga mat providing extra cushioning and support during yoga, Pilates, or other exercises. Anti-slip surface ensures stability for both men and women.",2025-02-12 16:04:48.188327,2025-02-12 16:04:48.188327
"Fashnex Resistance Band - 1.5 Meters Therapy Band - Exercise Band for Gym, Workout, Yoga, Physical Therapy, Home Exercise ...","[""All Exercise & Fitness""]",https://m.media-amazon.com/images/I/61MGJI4mUuS._AC_UL320_.jpg,4.4,88785,"A 1.5-meter resistance band designed for therapy, exercise, yoga, and physical therapy. Ideal for strengthening muscles, improving flexibility, and supporting rehabilitation.",2025-02-12 16:04:48.188327,2025-02-12 16:04:48.188327
Alan Jones Clothing Men's Slim Fit Track pants,"[""All Exercise & Fitness""]",https://m.media-amazon.com/images/I/81t3XS8UciL._AC_UL320_.jpg,4.0,240757,"Slim fit track pants designed for men, offering flexibility and comfort during workouts, running, or casual wear.",2025-02-12 16:04:48.188327,2025-02-12 16:04:48.188327
"FEGSY Resistance Tube Exercise Bands for Stretching, Workout, and Toning for Men, and Women - 50 LBS","[""All Exercise & Fitness""]",https://m.media-amazon.com/images/I/71zL20ACshL._AC_UL320_.jpg,3.9,185155,"A 50 lbs resistance tube band designed for stretching, toning, and strengthening exercises. Suitable for both men and women, perfect for home workouts.",2025-02-12 16:04:48.188327,2025-02-12 16:04:48.188327
Chromozome Men's Athletic Track Pants,"[""All Exercise & Fitness""]",https://m.media-amazon.com/images/I/81wP4aErT4L._AC_UL320_.jpg,3.7,178668,"Athletic track pants designed for men, offering comfort, flexibility, and breathability during workouts or outdoor activities.",2025-02-12 16:04:48.188327,2025-02-12 16:04:48.188327
"XTRIM Skipping Rope for Cardio Muscular Activities, Gym & Fitness Enthusiasts, Virgin PVC Rope, Ergonomic Handle, Lightwei...","[""All Exercise & Fitness""]",https://m.media-amazon.com/images/I/61rtQigzN5L._AC_UL320_.jpg,3.4,111019,"A lightweight skipping rope made from virgin PVC with ergonomic handles, perfect for cardio and muscular training. Ideal for gym enthusiasts and fitness enthusiasts.",2025-02-12 16:04:48.188327,2025-02-12 16:04:48.188327
"XTRIM Durafit Unisex Stylish Ankle Straps with Metal D-Rings for Cable Machine, Kickbacks and Glutes Workouts, Adjustable ...","[""All Exercise & Fitness""]",https://m.media-amazon.com/images/I/71prxn3VqNL._AC_UL320_.jpg,4.2,166621,"Durable ankle straps with metal D-rings, perfect for use with cable machines for glutes, kickbacks, and lower body workouts. Adjustable design for a secure fit.",2025-02-12 16:04:48.188327,2025-02-12 16:04:48.188327
"Cockatoo Anti-Burst Gym Ball ( 55 Cm to 95 Cm) with Foot Pump, Exercise Ball","[""All Exercise & Fitness""]",https://m.media-amazon.com/images/I/513+T+wyO3L._AC_UL320_.jpg,4.1,207581,"An anti-burst gym ball, ranging from 55 cm to 95 cm, with a foot pump for easy inflation. Ideal for stability, balance, and core strengthening exercises.",2025-02-12 16:04:48.188327,2025-02-12 16:04:48.188327
"Renewa Shoulder Exercise Equipment Rope with Pulley - Eco,Plastic Blue and Red","[""All Exercise & Fitness""]",https://m.media-amazon.com/images/I/41Pfcb8nDiL._AC_UL320_.jpg,3.9,46335,"A shoulder exercise equipment rope with a pulley system, designed to enhance shoulder mobility and strength. Made from eco-friendly plastic materials.",2025-02-12 16:04:48.188327,2025-02-12 16:04:48.188327
SPARNOD FITNESS SAB-05 Upright Air Bike Exercise Cycle for Home Gym - Dual Action for Full Body Workout - Adjustable Resis...,"[""All Exercise & Fitness""]",https://m.media-amazon.com/images/I/615evsyGKLL._AC_UL320_.jpg,4.3,3336120,"A dual-action upright air bike designed for full-body workouts, featuring adjustable resistance. Perfect for cardio, strengthening, and toning at home or in the gym.",2025-02-12 16:04:48.188327,2025-02-12 16:04:48.188327
Jockey Men's Cotton Track Pants,"[""All Exercise & Fitness""]",https://m.media-amazon.com/images/I/61qoz5T51VL._AC_UL320_.jpg,4.2,185155,"Comfortable cotton track pants for men, designed for casual wear, running, or light workouts. Soft, breathable fabric ensures comfort throughout the day.",2025-02-12 16:04:48.188327,2025-02-12 16:04:48.188327
"Hind Home Women's Ultra-Thin Transparent Nylon Ankle Length Socks (Beige Color, Free Sze) - Set of 10 Pair","[""All Exercise & Fitness""]",https://m.media-amazon.com/images/I/41VZexn3ZpL._AC_UL320_.jpg,3.8,129553,A set of 10 pairs of ultra-thin transparent nylon ankle-length socks for women. Beige color and free size fit for everyday comfort and style.,2025-02-12 16:04:48.188327,2025-02-12 16:04:48.188327
Gymwar Gym Gloves for Weight Lifting Crossfit Fitness Workout Exercise Hand Grips for Women (Free Size),"[""All Exercise & Fitness""]",https://m.media-amazon.com/images/W/IMAGERENDERING_521856-T1/images/I/41uj3alv9rL._AC_UL320_.jpg,3.9,148087,"Durable gym gloves designed for weightlifting and crossfit. Provides grip and wrist support, perfect for workout exercises, suitable for women with a free size fit.",2025-02-12 16:04:48.188327,2025-02-12 16:04:48.188327
"ARNV Yoga and Exercise Mat with Carrying Strap, 8mm","[""All Exercise & Fitness""]",https://m.media-amazon.com/images/W/IMAGERENDERING_521856-T1/images/I/71U9fJpqaFL._AC_UL320_.jpg,3.9,129553,"An 8mm thick yoga and exercise mat, designed for comfort and stability during workouts. Includes a carrying strap for easy portability.",2025-02-12 16:04:48.188327,2025-02-12 16:04:48.188327
Jockey Women's Cotton Boyshorts (Pack of 1) (SS04_Black_M_Black_M),"[""All Exercise & Fitness""]",https://m.media-amazon.com/images/W/IMAGERENDERING_521856-T1/images/I/7152PCh-V8L._AC_UL320_.jpg,4.2,46150,"Comfortable cotton boyshorts for women, designed for everyday wear or light activity. The black color provides versatility and comfort.",2025-02-12 16:04:48.188327,2025-02-12 16:04:48.188327
Star X PRO PVC weight 10kg with Dummbell rod,"[""All Exercise & Fitness""]",https://m.media-amazon.com/images/W/IMAGERENDERING_521856-T1/images/I/51U4BHYfPzL._AC_UL320_.jpg,3.2,370495,"A 10kg PVC-coated weight set with a dumbbell rod, designed for home or gym workouts. The durable construction provides optimal grip and safety for strength training and toning exercises.",2025-02-12 16:04:48.188327,2025-02-12 16:04:48.188327
"FitBox Sports Wall Mounting Chin Up Bar, Pull Up Bar & Ab Straps Combo","[""All Exercise & Fitness""]",https://m.media-amazon.com/images/W/IMAGERENDERING_521856-T1/images/I/51FS0XhYAnL._AC_UL320_.jpg,3.4,722641,"A versatile wall-mountable chin-up and pull-up bar combo, equipped with adjustable ab straps for a full-body workout. Ideal for building upper body strength, core stability, and toning.",2025-02-12 16:04:48.188327,2025-02-12 16:04:48.188327
"obliss Weight Loss Hot Slimming Belt for Men , Women Belly Sweat Slim Belt Neoprene Fat Burning Sauna Waist Trainer Health...","[""All Exercise & Fitness""]",https://m.media-amazon.com/images/W/IMAGERENDERING_521856-T1/images/I/61roYJfIUaL._AC_UL320_.jpg,3.3,222223,"A neoprene belly slimming belt designed for men and women, offering sauna-like effects to boost fat burning and promote sweat. Ideal for weight loss and toning the midsection during workouts.",2025-02-12 16:04:48.188327,2025-02-12 16:04:48.188327
BLUMORA Exercise Bands Resistance Bands Set for Workingout Door Fitness Gym Resistance Bands Kit for Men Women Streching R...,"[""All Exercise & Fitness""]",https://m.media-amazon.com/images/W/IMAGERENDERING_521856-T1/images/I/610kiYkbt8L._AC_UL320_.jpg,3.1,185155,"A complete resistance bands set, perfect for stretching, strength training, and rehabilitation exercises. Includes various resistance levels for men and women to use at home, the gym, or for physical therapy.",2025-02-12 16:04:48.188327,2025-02-12 16:04:48.188327
"Fashnex Skipping Rope for Men, Women & Children - Jump Rope for Exercise Workout & Weight Loss - Tangle Free Jumping Rope ...","[""All Exercise & Fitness""]",https://m.media-amazon.com/images/W/IMAGERENDERING_521856-T1/images/I/71DYbnDt+5L._AC_UL320_.jpg,4.5,129553,"A durable and tangle-free skipping rope designed for men, women, and children. Ideal for cardio, weight loss, and improving endurance, with adjustable length and comfortable handles for all fitness levels.",2025-02-12 16:04:48.188327,2025-02-12 16:04:48.188327
AmazonBasics Puzzle Exercise Mat with EVA Foam Interlocking Tiles,"[""All Exercise & Fitness""]",https://m.media-amazon.com/images/W/IMAGERENDERING_521856-T1/images/I/91T3ImnBwUL._AC_UL320_.jpg,4.2,1019370,"A set of EVA foam interlocking tiles that form a customizable puzzle exercise mat, providing cushioning and support for home gyms or fitness areas. Ideal for protecting floors during workouts.",2025-02-12 16:04:48.188327,2025-02-12 16:04:48.188327
"Proberos® Cotton Yoga Socks Sport Fitness Half Toe Ankle Grip Gym No-Slip Socks for Pilates, Barre, Ballet, Barefoot Workout","[""All Exercise & Fitness""]",https://m.media-amazon.com/images/W/IMAGERENDERING_521856-T1/images/I/61e5BpnZ5OL._AC_UL320_.jpg,4.1,163655,"Cotton yoga socks with half-toe design and ankle grip, providing a non-slip surface for Pilates, barre, ballet, and barefoot workouts. Perfect for improving stability and preventing slippage.",2025-02-12 16:04:48.188327,2025-02-12 16:04:48.188327
"USI UNIVERSAL THE UNBEATABLE Power Lifting Belt, 790PL_S Light Lifting Belt for Men & Women Weightlifting Competition Work...","[""All Exercise & Fitness""]",https://m.media-amazon.com/images/W/IMAGERENDERING_521856-T1/images/I/61C+i6EoJhL._AC_UL320_.jpg,4.4,333427,"A lightweight powerlifting belt designed for men and women, providing lumbar support and stability during heavy lifts. Ideal for weightlifting competitions or heavy-duty workouts.",2025-02-12 16:04:48.188327,2025-02-12 16:04:48.188327
Puma polyester 23 Cms Gym Bag(7572229_Pink_X_Red),"[""All Exercise & Fitness""]",https://m.media-amazon.com/images/W/IMAGERENDERING_521856-T1/images/I/81MHjhYl1YL._AC_UL320_.jpg,4.1,277825,"A stylish and durable polyester gym bag from Puma, with a 23 cm depth, featuring a sleek pink and red design. Perfect for carrying gym essentials, sportswear, or personal items.",2025-02-12 16:04:48.188327,2025-02-12 16:04:48.188327
"Lifelong LLM234 Crazyfit Vibration Plate Massager Machine for Full Body, Weight Loss,Muscle Toning, Pain Relief, Flexibili...","[""All Exercise & Fitness""]",https://m.media-amazon.com/images/W/IMAGERENDERING_521856-T1/images/I/71V74twbzmL._AC_UL320_.jpg,4.3,2594760,"A full-body vibration plate massager designed to aid weight loss, muscle toning, and pain relief. Offers multiple vibration settings for enhanced flexibility and recovery.",2025-02-12 16:04:48.188327,2025-02-12 16:04:48.188327
"QUADA Compression Swimming t Shirt Full Sleevs for Men (Black, Large)","[""All Exercise & Fitness""]",https://m.media-amazon.com/images/W/IMAGERENDERING_521856-T1/images/I/51fbEVpi+ZL._AC_UL320_.jpg,4.1,185155,"A compression swimming t-shirt designed for men, providing muscle support and reducing fatigue during swimming and water sports. The full sleeves design enhances performance and comfort.",2025-02-12 16:04:48.188327,2025-02-12 16:04:48.188327
"Just rider Bamboo Football Cotton Socks/Stockings for Men Women Knee High Length Superior Grip for Shin Guard, Anti Slip B...","[""All Exercise & Fitness""]",https://m.media-amazon.com/images/W/IMAGERENDERING_521856-T1/images/I/61Z-Mw7ii2L._AC_UL320_.jpg,4.0,129553,"Knee-high bamboo cotton football socks designed for men and women. Provides superior grip for shin guards and anti-slip properties, ensuring a secure fit during sports or athletic activities.",2025-02-12 16:04:48.188327,2025-02-12 16:04:48.188327
Vector X Skipping Rope (Black),"[""All Exercise & Fitness""]",https://m.media-amazon.com/images/W/IMAGERENDERING_521856-T1/images/I/51mTUuH-NGL._AC_UL320_.jpg,4.0,29654,"A high-quality skipping rope designed for fitness enthusiasts, featuring durable materials and adjustable length. Perfect for cardio workouts, weight loss, and improving coordination.",2025-02-12 16:04:48.188327,2025-02-12 16:04:48.188327
"Exercise Nylon and Rubber Wrist Wrap Bands, Deadlift Straps Wrist Support for Gym by STEIGEN FITNESS-SF","[""All Exercise & Fitness""]",https://m.media-amazon.com/images/W/IMAGERENDERING_521856-T1/images/I/81+E0T5zVAL._AC_UL320_.jpg,4.3,111019,A set of nylon and rubber wrist wraps designed to offer support during heavy lifting or deadlifts. Ideal for improving grip strength and preventing wrist injuries during strength training.,2025-02-12 16:04:48.188327,2025-02-12 16:04:48.188327
"Fitbox Sports Vinyl Coated PVC Intruder 20 Kg Weight Plates, 10Kg X 2(Black)","[""All Exercise & Fitness""]",https://m.media-amazon.com/images/W/IMAGERENDERING_521856-T1/images/I/71dyei1ouDL._AC_UL320_.jpg,3.8,449450,"A pair of 10 kg vinyl-coated PVC weight plates, designed for use with dumbbell rods or barbells. Ideal for strength training, these durable plates provide a versatile addition to any home gym.",2025-02-12 16:04:48.188327,2025-02-12 16:04:48.188327
Reach Digital Pedal Exercise Machine | Mini Fitness Cycle For Home With Fixing Strap | Adjustable Resistance Band & LCD Di...,"[""All Exercise & Fitness""]",https://m.media-amazon.com/images/W/IMAGERENDERING_521856-T1/images/I/712GMLoAJ4L._AC_UL320_.jpg,4.2,741360,"A compact digital pedal exercise machine, perfect for home use. Features adjustable resistance bands and an LCD display for tracking workout progress. Ideal for cardiovascular fitness and lower body toning.",2025-02-12 16:04:48.188327,2025-02-12 16:04:48.188327
Slovic Hand Grip With Counter | Hand Gripper Upto 60 Kg | Hand Grip Strengthener | Adjustable Resistance | Hand Grip Worko...,"[""All Exercise & Fitness""]",https://m.media-amazon.com/images/W/IMAGERENDERING_521856-T1/images/I/81ZvQvsxhQL._AC_UL320_.jpg,4.3,129553,"An adjustable hand grip strengthener with a counter, providing resistance up to 60 kg. Ideal for improving grip strength and forearm muscles during workouts or rehabilitation.",2025-02-12 16:04:48.188327,2025-02-12 16:04:48.188327
"PowerMax Fitness TD-M1-A1 Series - Light, Foldable, Electric Treadmill【100% Pre-Installed】 Running Machine for Max Pro-Wor...","[""All Exercise & Fitness""]",https://m.media-amazon.com/images/W/IMAGERENDERING_521856-T1/images/I/7190xlXlArL._AC_UL320_.jpg,4.4,11580043,"A lightweight, foldable electric treadmill designed for home use. Pre-installed and ready to use, perfect for running, walking, or jogging, with various speed settings and incline options for an effective workout.",2025-02-12 16:04:48.188327,2025-02-12 16:04:48.188327
"SG Century Model Cotton and Spandex Cricket Sleeve (Black, Large)","[""All Exercise & Fitness""]",https://m.media-amazon.com/images/W/IMAGERENDERING_521856-T1/images/I/915+UH1vOoL._AC_UL320_.jpg,4.0,42443,"A cotton and spandex cricket sleeve designed for protection and comfort during cricket matches. The large size provides a snug fit, ideal for both training and competitive play.",2025-02-12 16:04:48.188327,2025-02-12 16:04:48.188327
Pummelo 2 in 1 Foam Roller for deep tissue massage for muscle fitness exercise therapy yoga with bag medium with multi tri...,"[""All Exercise & Fitness""]",https://m.media-amazon.com/images/W/IMAGERENDERING_521856-T1/images/I/71qKMEs+sZL._AC_UL320_.jpg,4.4,370495,"A 2-in-1 foam roller designed for deep tissue massage and muscle fitness. Ideal for muscle recovery, stretching, and yoga therapy, it comes with a bag for easy portability.",2025-02-12 16:04:48.188327,2025-02-12 16:04:48.188327
